{
    "$schema": "http://json-schema.org/draft-07/schema#",
    "description": "Parameters for generating a secret with the Fuzzy Key Recovery system",
    "type": "object",
    "properties": {
        "setSize" : { 
            "type": "number",
            "description": "number of words in the original and recovery word list"
        },
        "corpusSize": { 
            "type": "number",
            "description": "size of the set of words to choose from"
        },
        "correctThreshold": {
            "type": "number",
            "description": "minimum number of correct words need to unlock keys\nless than or equal to setSize"
        },
        "prime": {
            "type": "number",
            "description": "a prime number in the range corpusSize < prime < 2 * corpusSize"
        },
        "extractor": {
            "type": "array",
            "description": "an array of numbers used in the key recovery process",
            "items": {
                "type": "number"
            }
        },
        "salt": { 
            "type": "string",
            "description": "salt to slow brute force attacks. Represents an array of bytes",
            "pattern": "^[0-9A-F]+$"
        },
        "sketch" : {
            "description": "an array of numbers used in the key recovery process",
            "items": {
                "type": "number"
            }
        },
        "hash" : {
            "type": "string",
            "description": "A 512-bit hash of the original words",
            "pattern": "^[0-9A-F]+$"
        }
    },
    "additionalProperties": false,
    "required": [
        "setSize",
        "corpusSize",
        "correctThreshold",
        "prime",
        "extractor",
        "salt",
        "sketch",
        "hash"
    ]
}
