{
    "setSize": 9,
    "corpusSize": 7776,
    "correctThreshold": 6,
    "prime": 7789,
    "extractor": [ 67, 4012, 1657, 6910, 6730, 3480, 4674, 3710, 3586 ],
    "salt": "5EE4975616255C5CAED6C99F3635FE4F22D351F7199AE2FA5101B3595CFDC396",
    "sketch": [ 7092, 3290, 961, 6128, 870, 7744 ],
    "hash": "43F96FCEAB353FB488A00186BA7358CA5F2BF0EB36EE70EC64FCD3113827BB66735176DF56AF105C8F6D6BBB9F7068F23CD7D897CF2CD5D2D5CE266715897E6E"
}
