{
  "setSize": 12,
  "correctThreshold": 9,
  "corpusSize": 7776,
  "prime": 7789,
  "extractor": [
    3768,
    2965,
    7549,
    7745,
    4154,
    916,
    2614,
    1062,
    7201,
    1460,
    1837,
    7232
  ],
  "salt": "B072A87F6E71F2D128A535713C05B0B6189ABD16A66B09ADAE349E801C0886BF",
  "sketch": [
    967,
    5576,
    1719,
    6542,
    2717,
    7711
  ],
  "hash": "BC7008F9ECD92C33914D14533D3BDB7597F751F632306F35F3DD800BE8AAFCA5C0EB022597FCC50FE84F73439F4CA0963718D3006517A4783224A3B14E4DC548"
}
